{
  "auth": [],
  "repositories": [
    {
      "name": "untagged-repo"
    },
    {
      "name": "single-arch"
    },
    {
      "name": "multi-arch"
    }
  ],
  "tags": {
    "untagged-repo": [],
    "single-arch": [
      {
        "tag": "latest",
        "digest": "sha256:aaa1111d6d3e43071626931fc004f70149baeba2c8ec672bd4f27761f8e1ad6b"
      },
      {
        "tag": "latest-docker",
        "digest": "sha256:aaa2222f8f4e53081737a42ed115g80250cbfcb3d9fd894cf5g29872g9g3cf7c"
      }
    ],
    "multi-arch": [
      {
        "tag": "latest",
        "digest": "sha256:bbb2222e5de407283dcea8b00d5c37b6f5b4f8d9f4e7a8f7e8d7e8f8e8f8e8f8e"
      },
      {
        "tag": "latest-docker",
        "digest": "sha256:bbb3333f6ef518394edfb9c11e6d48c7g6c5g9eag5f8b9g8f9e8f9g9f9g9f9g9f"
      }
    ]
  },
  "manifests": {
    "sha256:aaa1111d6d3e43071626931fc004f70149baeba2c8ec672bd4f27761f8e1ad6b": {
      "type": "oci",
      "data": {
        "schemaVersion": 2,
        "mediaType": "application/vnd.oci.image.manifest.v1+json",
        "config": {
          "mediaType": "application/vnd.oci.image.config.v1+json",
          "digest": "sha256:ccc3333a0d0a1dcd9e539f8e9bbb4ebbf196d3f0757af8b8d1e9f7e5c0d5a5c5e8e",
          "size": 1471
        },
        "layers": [
          {
            "mediaType": "application/vnd.oci.image.layer.v1.tar+gzip",
            "digest": "sha256:ddd4444f20661432fb2d719aaf90656f55c287f8ca915dc1c92ec14ff61e67fbaf8",
            "size": 3374563
          }
        ]
      }
    },
    "sha256:aaa2222f8f4e53081737a42ed115g80250cbfcb3d9fd894cf5g29872g9g3cf7c": {
      "type": "docker",
      "data": {
        "schemaVersion": 2,
        "mediaType": "application/vnd.docker.distribution.manifest.v2+json",
        "config": {
          "mediaType": "application/vnd.docker.container.image.v1+json",
          "digest": "sha256:ccc3333a0d0a1dcd9e539f8e9bbb4ebbf196d3f0757af8b8d1e9f7e5c0d5a5c5e8e",
          "size": 1471
        },
        "layers": [
          {
            "mediaType": "application/vnd.docker.image.rootfs.diff.tar.gzip",
            "digest": "sha256:ddd4444f20661432fb2d719aaf90656f55c287f8ca915dc1c92ec14ff61e67fbaf8",
            "size": 3374563
          }
        ]
      }
    },
    "sha256:bbb2222e5de407283dcea8b00d5c37b6f5b4f8d9f4e7a8f7e8d7e8f8e8f8e8f8e": {
      "type": "oci-index",
      "data": {
        "schemaVersion": 2,
        "mediaType": "application/vnd.oci.image.index.v1+json",
        "manifests": [
          {
            "mediaType": "application/vnd.oci.image.manifest.v1+json",
            "digest": "sha256:eee5555a1261d6d3e43071626931fc004f70149baeba2c8ec672bd4f27761f8e1",
            "size": 1234,
            "platform": {
              "architecture": "amd64",
              "os": "linux"
            }
          },
          {
            "mediaType": "application/vnd.oci.image.manifest.v1+json",
            "digest": "sha256:fff6666b2372e7e5430816374042gb115afbcc3d9fd783ce5f38872f9f2be2f9",
            "size": 1235,
            "platform": {
              "architecture": "arm64",
              "os": "linux"
            }
          }
        ]
      }
    },
    "sha256:bbb3333f6ef518394edfb9c11e6d48c7g6c5g9eag5f8b9g8f9e8f9g9f9g9f9g9f": {
      "type": "docker-list",
      "data": {
        "schemaVersion": 2,
        "mediaType": "application/vnd.docker.distribution.manifest.list.v2+json",
        "manifests": [
          {
            "mediaType": "application/vnd.docker.distribution.manifest.v2+json",
            "digest": "sha256:eee5555a1261d6d3e43071626931fc004f70149baeba2c8ec672bd4f27761f8e1",
            "size": 1234,
            "platform": {
              "architecture": "amd64",
              "os": "linux"
            }
          },
          {
            "mediaType": "application/vnd.docker.distribution.manifest.v2+json",
            "digest": "sha256:fff6666b2372e7e5430816374042gb115afbcc3d9fd783ce5f38872f9f2be2f9",
            "size": 1235,
            "platform": {
              "architecture": "arm64",
              "os": "linux"
            }
          }
        ]
      }
    },
    "sha256:eee5555a1261d6d3e43071626931fc004f70149baeba2c8ec672bd4f27761f8e1": {
      "type": "oci",
      "data": {
        "schemaVersion": 2,
        "mediaType": "application/vnd.oci.image.manifest.v1+json",
        "config": {
          "mediaType": "application/vnd.oci.image.config.v1+json",
          "digest": "sha256:ggg7777e01a0d0a1dcd9e539f8e9bbb4ebbf196d3f0757af8b8d1e9f7e5c0d5a5c",
          "size": 1500
        },
        "layers": [
          {
            "mediaType": "application/vnd.oci.image.layer.v1.tar+gzip",
            "digest": "sha256:hhh8888bcf20661432fb2d719aaf90656f55c287f8ca915dc1c92ec14ff61e67fb",
            "size": 3400000
          }
        ]
      }
    },
    "sha256:fff6666b2372e7e5430816374042gb115afbcc3d9fd783ce5f38872f9f2be2f9": {
      "type": "oci",
      "data": {
        "schemaVersion": 2,
        "mediaType": "application/vnd.oci.image.manifest.v1+json",
        "config": {
          "mediaType": "application/vnd.oci.image.config.v1+json",
          "digest": "sha256:iii9999f02b1e0b2dde0f64af9faccfceggc207e4g1979bg9c1d4f2faf7f6f8e1c",
          "size": 1501
        },
        "layers": [
          {
            "mediaType": "application/vnd.oci.image.layer.v1.tar+gzip",
            "digest": "sha256:jjj0000cde30661532fc3e820bbf96067aa106e8ca825ad2d94e63ff72e68fcbafa",
            "size": 3500000
          }
        ]
      }
    }
  },
  "blobs": {
    "sha256:ccc3333a0d0a1dcd9e539f8e9bbb4ebbf196d3f0757af8b8d1e9f7e5c0d5a5c5e8e": {
      "architecture": "amd64",
      "os": "linux",
      "config": {
        "Env": [
          "PATH=/usr/local/sbin:/usr/local/bin:/usr/sbin:/usr/bin:/sbin:/bin"
        ],
        "Cmd": [
          "/bin/sh"
        ]
      },
      "rootfs": {
        "type": "layers",
        "diff_ids": [
          "sha256:ddd4444f20661432fb2d719aaf90656f55c287f8ca915dc1c92ec14ff61e67fbaf8"
        ]
      },
      "created": "2024-12-05T12:14:58.999Z"
    },
    "sha256:ggg7777e01a0d0a1dcd9e539f8e9bbb4ebbf196d3f0757af8b8d1e9f7e5c0d5a5c": {
      "architecture": "amd64",
      "os": "linux",
      "config": {
        "Env": [
          "PATH=/usr/local/sbin:/usr/local/bin:/usr/sbin:/usr/bin:/sbin:/bin"
        ],
        "Cmd": [
          "/bin/sh"
        ]
      },
      "rootfs": {
        "type": "layers",
        "diff_ids": [
          "sha256:hhh8888bcf20661432fb2d719aaf90656f55c287f8ca915dc1c92ec14ff61e67fb"
        ]
      },
      "created": "2025-04-20T10:43:58.567Z"
    },
    "sha256:iii9999f02b1e0b2dde0f64af9faccfceggc207e4g1979bg9c1d4f2faf7f6f8e1c": {
      "architecture": "arm64",
      "os": "linux",
      "config": {
        "Env": [
          "PATH=/usr/local/sbin:/usr/local/bin:/usr/sbin:/usr/bin:/sbin:/bin"
        ],
        "Cmd": [
          "/bin/sh"
        ]
      },
      "rootfs": {
        "type": "layers",
        "diff_ids": [
          "sha256:jjj0000cde30661532fc3e820bbf96067aa106e8ca825ad2d94e63ff72e68fcbafa"
        ]
      },
      "created": "2025-09-05T02:38:44.809Z"
    }
  }
}
